{
  "schema_version": "1.0",
  "edition_id": "frontier-systems-review",
  "run": {
    "as_of": "2026-08-08T11:22:00+08:00",
    "coverage_start": "2026-08-07T17:52:00+08:00",
    "coverage_end": "2026-08-08T11:22:00+08:00",
    "timezone": "Asia/Shanghai",
    "actor": {
      "agent_id": "chatgpt-github",
      "runtime": "ChatGPT",
      "workflow_id": "newsflow-content-update",
      "workflow_version": "1.0.0",
      "model": "GPT-5.6 Sol"
    }
  },
  "candidates": [
    {
      "id": "nvidia-lancium-stargate-power-investment-2026",
      "channel_id": "ai-infrastructure",
      "event_type": "financing",
      "event_date": "2026-08-08",
      "title": "Nvidia 拟向 Lancium 投资至多 30 亿美元，AI 芯片厂商开始直接押注 Stargate 的电力与并网资产",
      "url": "https://www.reuters.com/business/nvidia-invest-up-3-billion-lancium-information-reports-2026-08-08/",
      "published_at": "2026-08-08T01:42:00Z",
      "retrieved_at": "2026-08-08T11:22:00+08:00",
      "short_summary": "Reuters 转述 The Information 称，Nvidia 拟向 Lancium 投资至多 30 亿美元；Lancium 持有 Stargate 首个运营站点相关土地与电力连接资源，追加投资还与并网等里程碑挂钩。",
      "long_summary": "如果交易按报道落地，它把 Nvidia 的基础设施角色从 GPU 供应继续推进到数据中心电力和并网资源的资本配置。初始约 20% 股权投资与后续并网条件意味着，芯片供给商正在把电力接入视为保障 AI 系统部署速度的战略资产。由于 Reuters 未获得 Nvidia 或 Lancium 的直接确认，这条信息应由编辑部保留来源限制，并在后续公司披露中复核。",
      "tags": [
        "AI & Tech",
        "Data Center",
        "Power Infrastructure",
        "Stargate",
        "Nvidia"
      ],
      "storyline_ids": [
        "ai-energy-foundation",
        "ai-infrastructure-layer"
      ],
      "scores": {
        "facts": 4.2,
        "source": 3.6,
        "timeliness": 5.0,
        "news_quality": 3.8,
        "industry_impact": 4.7
      },
      "verification": {
        "full_text_accessed": true,
        "summary_supported_sentence_by_sentence": true,
        "attributed_to_source": true,
        "stakeholder_position_attributed": true
      },
      "evidence": [
        {
          "claim": "报道称 Nvidia 拟向 Lancium 投资至多 30 亿美元。",
          "source_excerpt": "will invest up to $3 billion in power infrastructure developer Lancium",
          "source_url": "https://www.reuters.com/business/nvidia-invest-up-3-billion-lancium-information-reports-2026-08-08/"
        },
        {
          "claim": "追加投资与包括并网在内的项目里程碑挂钩。",
          "source_excerpt": "additional $1 billion if the company meets certain thresholds, including grid hookups",
          "source_url": "https://www.reuters.com/business/nvidia-invest-up-3-billion-lancium-information-reports-2026-08-08/"
        }
      ]
    },
    {
      "id": "texas-data-center-grid-deposit-risk-2026",
      "channel_id": "ai-infrastructure",
      "event_type": "grid_interconnection",
      "event_date": "2026-08-08",
      "title": "得州数据中心并网暂停开始转化为真实资本风险：巨额押金面临长期冻结与更高不可退比例",
      "url": "https://www.reuters.com/legal/litigation/hundreds-millions-grid-deposits-linger-uncertainty-following-texas-data-center-2026-08-07/",
      "published_at": "2026-08-07T16:44:33Z",
      "retrieved_at": "2026-08-08T11:22:00+08:00",
      "short_summary": "得州暂停数据中心并网审批后，Batch Zero 项目此前按每兆瓦 5 万美元缴纳的并网担保资金面临不确定性；监管草案还可能把部分项目押金的不可退比例从 20% 提高到 80%。",
      "long_summary": "这条更新不是重复此前的“得州暂停并网”事实，而是把监管不确定性量化成项目级资本风险。对于超大规模 AI 数据中心，电网审批现在不仅决定投产时间，还可能锁住数千万甚至上亿美元前期资金，并改变项目继续推进或退出的经济性。它强化了 NewsFlow 对 AI 能源层的判断：并网权、审批节奏和监管条款正在成为与电源容量同等重要的基础设施约束。",
      "tags": [
        "AI & Tech",
        "Data Center",
        "Grid Interconnection",
        "Texas",
        "Regulation"
      ],
      "storyline_ids": [
        "ai-energy-foundation",
        "ai-infrastructure-layer"
      ],
      "scores": {
        "facts": 4.9,
        "source": 4.6,
        "timeliness": 4.9,
        "news_quality": 4.8,
        "industry_impact": 5.0
      },
      "verification": {
        "full_text_accessed": true,
        "summary_supported_sentence_by_sentence": true,
        "attributed_to_source": true,
        "stakeholder_position_attributed": true
      },
      "evidence": [
        {
          "claim": "并网暂停使数据中心项目已缴纳的担保资金面临损失风险。",
          "source_excerpt": "risk losing their deposits without a clear pathway to power up",
          "source_url": "https://www.reuters.com/legal/litigation/hundreds-millions-grid-deposits-linger-uncertainty-following-texas-data-center-2026-08-07/"
        },
        {
          "claim": "监管草案可能显著提高相关押金的不可退比例。",
          "source_excerpt": "change the nonrefundable portion of many data center deposits to 80% from the current 20%",
          "source_url": "https://www.reuters.com/legal/litigation/hundreds-millions-grid-deposits-linger-uncertainty-following-texas-data-center-2026-08-07/"
        }
      ]
    },
    {
      "id": "switch-data-center-ipo-filing-2026",
      "channel_id": "ai-infrastructure",
      "event_type": "financing",
      "event_date": "2026-08-08",
      "title": "Switch 据报已秘密提交美国 IPO，数据中心资本市场继续为 AI 基础设施扩张定价",
      "url": "https://www.reuters.com/legal/transactional/data-center-firm-switch-confidentially-files-us-ipo-bloomberg-news-reports-2026-08-07/",
      "published_at": "2026-08-07T22:12:04Z",
      "retrieved_at": "2026-08-08T11:22:00+08:00",
      "short_summary": "Reuters 转述 Bloomberg 称，数据中心运营商 Switch 已秘密提交美国 IPO；Reuters 此前报道其融资规模可能达到 100 亿美元、含债务估值接近 800 亿美元，但本次 filing 尚未获 Reuters 独立确认。",
      "long_summary": "这条信息提供了 AI 基础设施融资环境的新增信号：大型数据中心平台正在尝试把持续的 GPU 集群、电力、制冷和连接需求转化为公开资本市场融资。若融资规模接近此前报道水平，它将成为市场对长期 AI 数据中心现金流和资产估值的一次重要测试。由于核心 filing 信息来自匿名信源且 Reuters 明确表示尚未独立核实，因此应保留为编辑部候选，不应在没有进一步确认前赋予过高事实权重。",
      "tags": [
        "AI & Tech",
        "Data Center",
        "Financing",
        "IPO"
      ],
      "storyline_ids": [
        "ai-infrastructure-layer"
      ],
      "scores": {
        "facts": 3.8,
        "source": 3.3,
        "timeliness": 4.6,
        "news_quality": 3.4,
        "industry_impact": 3.8
      },
      "verification": {
        "full_text_accessed": true,
        "summary_supported_sentence_by_sentence": true,
        "attributed_to_source": true,
        "stakeholder_position_attributed": true
      },
      "evidence": [
        {
          "claim": "Bloomberg 报道 Switch 已秘密提交美国 IPO。",
          "source_excerpt": "filed confidentially for a U.S. initial public offering",
          "source_url": "https://www.reuters.com/legal/transactional/data-center-firm-switch-confidentially-files-us-ipo-bloomberg-news-reports-2026-08-07/"
        },
        {
          "claim": "Reuters 此前报道潜在融资规模可达 100 亿美元。",
          "source_excerpt": "could raise up to $10 billion as soon as the fourth quarter",
          "source_url": "https://www.reuters.com/legal/transactional/data-center-firm-switch-confidentially-files-us-ipo-bloomberg-news-reports-2026-08-07/"
        }
      ]
    },
    {
      "id": "openai-astra-critical-cyber-deployment-controls-2026",
      "channel_id": "ai-infrastructure",
      "event_type": "deployment_requirement",
      "event_date": "2026-08-08",
      "title": "OpenAI 称 Astra 不能排除达到“关键”网络安全能力，模型能力提升开始直接改变部署与隔离要求",
      "url": "https://www.reuters.com/legal/litigation/openai-flags-possible-critical-cybersecurity-risk-upcoming-model-tightens-2026-08-07/",
      "published_at": "2026-08-07T17:46:00Z",
      "retrieved_at": "2026-08-08T11:22:00+08:00",
      "short_summary": "OpenAI 表示其即将发布的 Astra 模型初步评估强到无法排除达到“critical”网络安全能力门槛，并因此暂停部分内部活动、强化安全控制，把开发迁入受限网络和沙箱隔离环境。",
      "long_summary": "这条信息的重要性不在于又一次模型能力提升，而在于能力提升开始改变模型的工程部署条件。若模型可能自主发现和利用严重漏洞，开发者就需要把网络隔离、沙箱执行、访问控制和外部评估作为模型发布路径的一部分。它为 AI 模型层提供了一个新的基础设施约束：能力越强，安全隔离和运行环境本身越可能成为部署成本与发布节奏的重要组成部分。",
      "tags": [
        "AI & Tech",
        "Model Deployment",
        "Cybersecurity",
        "OpenAI"
      ],
      "storyline_ids": [
        "ai-model-layer",
        "ai-infrastructure-layer"
      ],
      "scores": {
        "facts": 4.8,
        "source": 4.5,
        "timeliness": 5.0,
        "news_quality": 4.6,
        "industry_impact": 4.3
      },
      "verification": {
        "full_text_accessed": true,
        "summary_supported_sentence_by_sentence": true,
        "attributed_to_source": true,
        "stakeholder_position_attributed": true
      },
      "evidence": [
        {
          "claim": "OpenAI 表示无法排除 Astra 达到其关键网络安全能力门槛。",
          "source_excerpt": "cannot rule out that its upcoming AI model, Astra, has critical cybersecurity capabilities",
          "source_url": "https://www.reuters.com/legal/litigation/openai-flags-possible-critical-cybersecurity-risk-upcoming-model-tightens-2026-08-07/"
        },
        {
          "claim": "Astra 的开发环境将采用更严格的隔离和网络限制。",
          "source_excerpt": "moved into isolated testing environments with restricted network access",
          "source_url": "https://www.reuters.com/legal/litigation/openai-flags-possible-critical-cybersecurity-risk-upcoming-model-tightens-2026-08-07/"
        }
      ]
    }
  ]
}
